{
  "catalogId": "logsense-relation-evidence-basis-catalog",
  "version": "0.1.0",
  "bases": [
    {
      "basisId": "ADAPTER_DECLARED_RELATION",
      "basisClass": "SOURCE_DECLARED",
      "description": "Adapter Declared Relation",
      "canPropose": true,
      "canEstablishWhenAllowedByRelation": true,
      "requiresRuntimeEvidence": false,
      "hardNegatives": [],
      "haiecReferences": [
        "lib/evidence/semantic-relation-projection.ts"
      ],
      "notes": []
    },
    {
      "basisId": "AI_MAPPING_PROPOSAL",
      "basisClass": "WEAK_OR_FORBIDDEN",
      "description": "Ai Mapping Proposal",
      "canPropose": true,
      "canEstablishWhenAllowedByRelation": false,
      "requiresRuntimeEvidence": false,
      "hardNegatives": [],
      "haiecReferences": [
        "lib/evidence/semantic-relation-projection.ts"
      ],
      "notes": []
    },
    {
      "basisId": "AI_PROPOSAL_ONLY",
      "basisClass": "WEAK_OR_FORBIDDEN",
      "description": "Ai Proposal Only",
      "canPropose": true,
      "canEstablishWhenAllowedByRelation": false,
      "requiresRuntimeEvidence": false,
      "hardNegatives": [],
      "haiecReferences": [
        "lib/evidence/semantic-relation-projection.ts"
      ],
      "notes": []
    },
    {
      "basisId": "ATTESTATION_RECORD",
      "basisClass": "OTHER_DETERMINISTIC",
      "description": "Attestation Record",
      "canPropose": true,
      "canEstablishWhenAllowedByRelation": true,
      "requiresRuntimeEvidence": false,
      "hardNegatives": [],
      "haiecReferences": [
        "lib/evidence/semantic-relation-projection.ts"
      ],
      "notes": []
    },
    {
      "basisId": "AUTHORIZATION_BINDING",
      "basisClass": "AUTHORITY_BINDING",
      "description": "Authorization Binding",
      "canPropose": true,
      "canEstablishWhenAllowedByRelation": true,
      "requiresRuntimeEvidence": false,
      "hardNegatives": [],
      "haiecReferences": [
        "lib/evidence/semantic-relation-projection.ts"
      ],
      "notes": []
    },
    {
      "basisId": "BOUND_AUTHORITY_RECORD",
      "basisClass": "AUTHORITY_BINDING",
      "description": "Bound Authority Record",
      "canPropose": true,
      "canEstablishWhenAllowedByRelation": true,
      "requiresRuntimeEvidence": false,
      "hardNegatives": [],
      "haiecReferences": [
        "lib/evidence/semantic-relation-projection.ts"
      ],
      "notes": []
    },
    {
      "basisId": "BUILD_PROVENANCE",
      "basisClass": "LINEAGE_PROVENANCE",
      "description": "Build Provenance",
      "canPropose": true,
      "canEstablishWhenAllowedByRelation": true,
      "requiresRuntimeEvidence": false,
      "hardNegatives": [],
      "haiecReferences": [
        "lib/evidence/semantic-relation-projection.ts"
      ],
      "notes": []
    },
    {
      "basisId": "CASE_ANALYSIS",
      "basisClass": "OTHER_DETERMINISTIC",
      "description": "Case Analysis",
      "canPropose": true,
      "canEstablishWhenAllowedByRelation": false,
      "requiresRuntimeEvidence": false,
      "hardNegatives": [],
      "haiecReferences": [
        "lib/evidence/semantic-relation-projection.ts"
      ],
      "notes": []
    },
    {
      "basisId": "CAUSE_RULE_OUTPUT",
      "basisClass": "OTHER_DETERMINISTIC",
      "description": "Cause Rule Output",
      "canPropose": true,
      "canEstablishWhenAllowedByRelation": false,
      "requiresRuntimeEvidence": false,
      "hardNegatives": [],
      "haiecReferences": [
        "lib/evidence/semantic-relation-projection.ts"
      ],
      "notes": []
    },
    {
      "basisId": "CHAIN_OF_CUSTODY",
      "basisClass": "LINEAGE_PROVENANCE",
      "description": "Chain Of Custody",
      "canPropose": true,
      "canEstablishWhenAllowedByRelation": true,
      "requiresRuntimeEvidence": false,
      "hardNegatives": [],
      "haiecReferences": [
        "lib/evidence/semantic-relation-projection.ts"
      ],
      "notes": []
    },
    {
      "basisId": "COMPARABLE_CLAIM_ANALYSIS",
      "basisClass": "OTHER_DETERMINISTIC",
      "description": "Comparable Claim Analysis",
      "canPropose": true,
      "canEstablishWhenAllowedByRelation": true,
      "requiresRuntimeEvidence": false,
      "hardNegatives": [],
      "haiecReferences": [
        "lib/evidence/semantic-relation-projection.ts"
      ],
      "notes": []
    },
    {
      "basisId": "CONFIG_MAPPING",
      "basisClass": "OTHER_DETERMINISTIC",
      "description": "Config Mapping",
      "canPropose": true,
      "canEstablishWhenAllowedByRelation": false,
      "requiresRuntimeEvidence": false,
      "hardNegatives": [],
      "haiecReferences": [
        "lib/evidence/semantic-relation-projection.ts"
      ],
      "notes": []
    },
    {
      "basisId": "CORRELATION_ONLY",
      "basisClass": "WEAK_OR_FORBIDDEN",
      "description": "Correlation Only",
      "canPropose": true,
      "canEstablishWhenAllowedByRelation": false,
      "requiresRuntimeEvidence": false,
      "hardNegatives": [],
      "haiecReferences": [
        "lib/evidence/semantic-relation-projection.ts"
      ],
      "notes": []
    },
    {
      "basisId": "CORRELATION_SUPPORTED",
      "basisClass": "CORRELATION_SUPPORT",
      "description": "Correlation Supported",
      "canPropose": true,
      "canEstablishWhenAllowedByRelation": false,
      "requiresRuntimeEvidence": false,
      "hardNegatives": [],
      "haiecReferences": [
        "lib/evidence/semantic-relation-projection.ts"
      ],
      "notes": []
    },
    {
      "basisId": "DECLARED_DELEGATION_HINT",
      "basisClass": "OTHER_DETERMINISTIC",
      "description": "Declared Delegation Hint",
      "canPropose": true,
      "canEstablishWhenAllowedByRelation": false,
      "requiresRuntimeEvidence": false,
      "hardNegatives": [],
      "haiecReferences": [
        "lib/evidence/semantic-relation-projection.ts"
      ],
      "notes": []
    },
    {
      "basisId": "DERIVATION_MANIFEST",
      "basisClass": "LINEAGE_PROVENANCE",
      "description": "Derivation Manifest",
      "canPropose": true,
      "canEstablishWhenAllowedByRelation": true,
      "requiresRuntimeEvidence": false,
      "hardNegatives": [],
      "haiecReferences": [
        "lib/evidence/semantic-relation-projection.ts"
      ],
      "notes": []
    },
    {
      "basisId": "DISPLAY_NAME_ONLY",
      "basisClass": "WEAK_OR_FORBIDDEN",
      "description": "Display Name Only",
      "canPropose": true,
      "canEstablishWhenAllowedByRelation": false,
      "requiresRuntimeEvidence": false,
      "hardNegatives": [],
      "haiecReferences": [
        "lib/evidence/semantic-relation-projection.ts"
      ],
      "notes": []
    },
    {
      "basisId": "DOMAIN_NATIVE_RELATION",
      "basisClass": "SOURCE_DECLARED",
      "description": "Domain Native Relation",
      "canPropose": true,
      "canEstablishWhenAllowedByRelation": true,
      "requiresRuntimeEvidence": false,
      "hardNegatives": [],
      "haiecReferences": [
        "lib/evidence/semantic-relation-projection.ts"
      ],
      "notes": []
    },
    {
      "basisId": "DOMAIN_SCHEMA_MAPPING",
      "basisClass": "OTHER_DETERMINISTIC",
      "description": "Domain Schema Mapping",
      "canPropose": true,
      "canEstablishWhenAllowedByRelation": false,
      "requiresRuntimeEvidence": false,
      "hardNegatives": [],
      "haiecReferences": [
        "lib/evidence/semantic-relation-projection.ts"
      ],
      "notes": []
    },
    {
      "basisId": "EVENT_CONTRADICTION_PROJECTION",
      "basisClass": "OTHER_DETERMINISTIC",
      "description": "Event Contradiction Projection",
      "canPropose": true,
      "canEstablishWhenAllowedByRelation": true,
      "requiresRuntimeEvidence": false,
      "hardNegatives": [],
      "haiecReferences": [
        "lib/evidence/semantic-relation-projection.ts"
      ],
      "notes": []
    },
    {
      "basisId": "EXACT_ENDPOINT_JOIN",
      "basisClass": "STATIC_EXACT",
      "description": "Exact Endpoint Join",
      "canPropose": true,
      "canEstablishWhenAllowedByRelation": true,
      "requiresRuntimeEvidence": false,
      "hardNegatives": [],
      "haiecReferences": [
        "lib/evidence/semantic-relation-projection.ts"
      ],
      "notes": []
    },
    {
      "basisId": "EXPLICIT_CASE_MEMBERSHIP",
      "basisClass": "OTHER_DETERMINISTIC",
      "description": "Explicit Case Membership",
      "canPropose": true,
      "canEstablishWhenAllowedByRelation": true,
      "requiresRuntimeEvidence": false,
      "hardNegatives": [],
      "haiecReferences": [
        "lib/evidence/semantic-relation-projection.ts"
      ],
      "notes": []
    },
    {
      "basisId": "EXPLICIT_DECISION_PROVENANCE_RECORD",
      "basisClass": "LINEAGE_PROVENANCE",
      "description": "Explicit Decision Provenance Record",
      "canPropose": true,
      "canEstablishWhenAllowedByRelation": true,
      "requiresRuntimeEvidence": false,
      "hardNegatives": [],
      "haiecReferences": [
        "lib/evidence/semantic-relation-projection.ts"
      ],
      "notes": []
    },
    {
      "basisId": "EXPLICIT_DELEGATION_RECORD",
      "basisClass": "OTHER_DETERMINISTIC",
      "description": "Explicit Delegation Record",
      "canPropose": true,
      "canEstablishWhenAllowedByRelation": true,
      "requiresRuntimeEvidence": false,
      "hardNegatives": [],
      "haiecReferences": [
        "lib/evidence/semantic-relation-projection.ts"
      ],
      "notes": []
    },
    {
      "basisId": "EXPLICIT_ORDERING_RECORD",
      "basisClass": "OTHER_DETERMINISTIC",
      "description": "Explicit Ordering Record",
      "canPropose": true,
      "canEstablishWhenAllowedByRelation": true,
      "requiresRuntimeEvidence": false,
      "hardNegatives": [],
      "haiecReferences": [
        "lib/evidence/semantic-relation-projection.ts"
      ],
      "notes": []
    },
    {
      "basisId": "EXPLICIT_PREDECESSOR",